{"runSummary":{"departmentRunId":"dept-2026-08-18T025944Z","reportGeneratedAt":"2026-08-18T03:00:04.073Z","ga4Connected":true,"gtmConnected":true},"measurementFindings":[{"claimType":"FACT","statement":"En esta pasada GA4 y GTM se leyeron en vivo, con datos de GA4 correspondientes al periodo 2026-07-20 a 2026-08-17.","evidenceIds":[]},{"claimType":"FACT","statement":"El contenedor GTM tiene 8 tags (7 de tipo gaawe mas 1 Google Tag) y 7 triggers, y ninguno de los 8 tags aparece pausado.","evidenceIds":["ev23","ev26"]},{"claimType":"OBSERVATION","statement":"De los 7 eventos clave listados, 6 se dispararon al menos una vez en el periodo (generate_lead_form_submit, click_whatsapp, click_request_quote, click_catalog_download, view_quote_page, view_contact_page) mientras que click_phone no se disparo ninguna vez, pese a existir un tag GA4 Event - click_phone no pausado y un trigger click_phone de tipo linkClick.","evidenceIds":["ev13","ev24","ev25"]},{"claimType":"OBSERVATION","statement":"Entre los eventos que si se dispararon, generate_lead_form_submit, click_whatsapp y click_request_quote muestran conversiones iguales a sus ocurrencias, mientras que click_catalog_download, view_quote_page y view_contact_page se dispararon pero registraron 0 conversiones.","evidenceIds":["ev11","ev12","ev14","ev15","ev16","ev17"]}],"funnelObservations":[{"claimType":"FACT","statement":"En el periodo, view_quote_page se disparo 12 veces, click_request_quote se disparo 66 veces y generate_lead_form_submit se disparo 6 veces.","evidenceIds":["ev16","ev14","ev11"]},{"claimType":"OBSERVATION","statement":"Las ocurrencias de click_request_quote (66) superan ampliamente a las de view_quote_page (12), es decir, el CTA de solicitar presupuesto se dispara mas de 5 veces mas que las visitas registradas a la pagina de presupuesto.","evidenceIds":["ev14","ev16"]},{"claimType":"OBSERVATION","statement":"Solo se registraron 6 eventos generate_lead_form_submit frente a 66 eventos click_request_quote, lo que indica una caida considerable entre el clic en el CTA de presupuesto y el envio final del formulario.","evidenceIds":["ev14","ev11"]},{"claimType":"FACT","statement":"view_contact_page se disparo 39 veces con 0 conversiones registradas, y el otro evento asociado a contacto directo, click_phone, no se disparo ninguna vez en el periodo.","evidenceIds":["ev17","ev13"]}],"trafficObservations":[{"claimType":"FACT","statement":"El canal Direct concentro 172 de aproximadamente 186 sesiones totales y 81 de aproximadamente 87 conversiones totales, sumando los cinco canales listados (Direct, Organic Search, Referral, AI Assistant, Unassigned).","evidenceIds":["ev1","ev2","ev3","ev4","ev5"]},{"claimType":"OBSERVATION","statement":"Los canales Organic Search, Referral, AI Assistant y Unassigned suman conjuntamente 14 sesiones (8+3+2+1), muy por debajo de las 172 sesiones del canal Direct.","evidenceIds":["ev1","ev2","ev3","ev4","ev5"]},{"claimType":"FACT","statement":"La landing page \"/\" recibio 115 sesiones y 59 conversiones con una tasa de rebote del 31.3%, siendo la landing page con mas trafico del periodo.","evidenceIds":["ev6"]},{"claimType":"FACT","statement":"En fuente/medio, (direct)/(none) aporto 172 sesiones y 81 conversiones, mientras que tagassistant.google.com/referral aporto 3 sesiones y 2 conversiones.","evidenceIds":["ev18","ev19"]}],"conversionObservations":[{"claimType":"FACT","statement":"La landing page /product/taquilla-2-puertas-modulo-1-melamina registro 4 sesiones pero 11 conversiones en el periodo.","evidenceIds":["ev8"]},{"claimType":"OBSERVATION","statement":"Varias landing pages con 3-4 sesiones registraron 0 conversiones (/cerraduras-para-taquillas, /taquillas-metalicas), mientras que /configurador-bancos, con 10 sesiones, registro 6 conversiones.","evidenceIds":["ev9","ev10","ev7"]},{"claimType":"FACT","statement":"click_request_quote es el evento clave con mas volumen del periodo, con 66 ocurrencias y 66 conversiones, mas del doble que cualquier otro evento clave listado.","evidenceIds":["ev14"]}],"trackingIssues":[{"claimType":"FACT","statement":"El evento clave click_phone no se disparo en el periodo (0 ocurrencias) pese a existir un tag GA4 Event - click_phone no pausado y un trigger click_phone de tipo linkClick en la version live del contenedor GTM.","evidenceIds":["ev13","ev24","ev25"]},{"claimType":"OBSERVATION","statement":"click_catalog_download se disparo 4 veces pero registro 0 conversiones, a diferencia de click_whatsapp, click_request_quote y generate_lead_form_submit, cuyas conversiones igualan sus ocurrencias.","evidenceIds":["ev15","ev12","ev14","ev11"]},{"claimType":"FACT","statement":"La version live de GTM se llama \"O44 - Eventos CTA nuevos (sin publicar, pendiente aprobacion Pau) (id 5)\", nombre que incluye el texto \"sin publicar, pendiente aprobacion Pau\" pese a ser reportada como la version live del contenedor.","evidenceIds":["ev23"]},{"claimType":"OBSERVATION","statement":"La fuente de trafico tagassistant.google.com esta clasificada como canal Referral y aporto 3 sesiones y 2 conversiones en el periodo.","evidenceIds":["ev19","ev3"]}],"anomalyCandidates":[{"claimType":"OBSERVATION","statement":"La landing page /product/taquilla-2-puertas-modulo-1-melamina muestra mas conversiones (11) que sesiones (4) en el periodo.","evidenceIds":["ev8"]},{"claimType":"OBSERVATION","statement":"Las ocurrencias de click_request_quote (66) superan en mas de 5 veces a las de view_quote_page (12).","evidenceIds":["ev14","ev16"]},{"claimType":"OBSERVATION","statement":"El canal/fuente Direct - (direct)/(none) concentra mas del 90% de las sesiones y conversiones entre los canales listados, dejando el resto de canales combinados en solo 14 sesiones.","evidenceIds":["ev1","ev18"]},{"claimType":"OBSERVATION","statement":"click_phone muestra cero ocurrencias mientras su tag y trigger correspondientes en GTM estan presentes y no pausados.","evidenceIds":["ev13","ev24","ev25"]}],"hypotheses":[{"claimType":"HYPOTHESIS","statement":"La diferencia entre las ocurrencias de click_request_quote (66) y view_quote_page (12) podria explicarse porque el CTA de solicitar presupuesto esta presente en paginas distintas a la pagina dedicada de presupuesto (por ejemplo la home), y no solo en /solicitar-presupuesto/.","evidenceIds":["ev14","ev16"]},{"claimType":"HYPOTHESIS","statement":"La ausencia de eventos click_phone pese a tener tag y trigger activos podria deberse a que ningun visitante interactuo con un enlace de telefono en el periodo, o a que las condiciones del trigger no coinciden con el marcado actual del enlace en el sitio en vivo.","evidenceIds":["ev13","ev24","ev25"]},{"claimType":"HYPOTHESIS","statement":"Que las conversiones superen a las sesiones en /product/taquilla-2-puertas-modulo-1-melamina podria indicar que GA4 esta contando varios eventos de conversion por sesion (por ejemplo varios clics en click_request_quote) en lugar de un error de datos.","evidenceIds":["ev8","ev14"]},{"claimType":"HYPOTHESIS","statement":"La alta concentracion de sesiones bajo (direct)/(none) podria incluir en parte trafico cuyo referrer original no se transmitio a GA4 (por ejemplo enlaces compartidos por aplicaciones de mensajeria o campanas sin parametros UTM), y no ser exclusivamente navegacion directa genuina.","evidenceIds":["ev18","ev1"]},{"claimType":"HYPOTHESIS","statement":"Las sesiones desde tagassistant.google.com clasificadas como Referral podrian corresponder a actividad interna de QA/pruebas usando Google Tag Assistant, en lugar de clientes potenciales reales.","evidenceIds":["ev19"]}],"recommendedMeasurements":[{"claimType":"RECOMMENDATION","statement":"Validar en GA4 DebugView si el trigger click_phone se dispara correctamente al interactuar con enlaces de telefono en el sitio en vivo, dado que muestra 0 ocurrencias pese a tener tag y trigger activos.","evidenceIds":["ev13","ev24","ev25"]},{"claimType":"RECOMMENDATION","statement":"Confirmar en la administracion de GA4 si click_catalog_download, view_quote_page y view_contact_page estan marcados como eventos clave/conversiones, ya que se dispararon en el periodo pero registraron 0 conversiones a diferencia de otros eventos de CTA.","evidenceIds":["ev15","ev16","ev17"]},{"claimType":"RECOMMENDATION","statement":"Revisar si la version de GTM \"O44 - Eventos CTA nuevos\", cuyo nombre hace referencia a estar sin publicar y pendiente de aprobacion de Pau, es realmente la version que esta sirviendo en el contenedor live.","evidenceIds":["ev23"]},{"claimType":"RECOMMENDATION","statement":"Anadir una segmentacion o filtro de exclusion en GA4 para separar las sesiones de referral tagassistant.google.com del trafico genuino de usuarios.","evidenceIds":["ev19"]},{"claimType":"RECOMMENDATION","statement":"Investigar en que paginas del sitio esta ubicado el trigger/CTA de click_request_quote (no solo en /solicitar-presupuesto/) para explicar la diferencia de ocurrencias respecto a view_quote_page.","evidenceIds":["ev14","ev16"]},{"claimType":"RECOMMENDATION","statement":"Verificar en GA4 Explore el desglose de sesiones/conversiones de /product/taquilla-2-puertas-modulo-1-melamina para confirmar si las 11 conversiones sobre 4 sesiones reflejan multiples eventos de conversion por sesion.","evidenceIds":["ev8"]}],"prioritizedActions":[{"claimType":"RECOMMENDATION","statement":"Validar en GA4 DebugView el funcionamiento del trigger/tag click_phone, dado que es un evento clave de contacto sin ninguna ocurrencia registrada en el periodo.","evidenceIds":["ev13","ev24","ev25"],"priority":"high"},{"claimType":"RECOMMENDATION","statement":"Confirmar el estado real de publicacion de la version live de GTM, cuyo nombre sugiere que hay cambios sin publicar pendientes de aprobacion.","evidenceIds":["ev23"],"priority":"high"},{"claimType":"RECOMMENDATION","statement":"Confirmar que eventos clave (click_catalog_download, view_quote_page, view_contact_page) estan marcados como conversiones en GA4, ya q